{
  "meta": { "schemaVersion": "0.1.0", "kind": "screen", "id": "screen_invite_review", "title": "Review Invitations", "source": "manual", "status": "candidate" },
  "context": { "productType": "team-management", "targetUsers": ["workspace-owner"], "primaryUseCase": "送信前に宛先、Role、Seat影響を確認する", "userIntent": "誤招待や過剰権限がないことを確認して送信したい", "constraints": ["owner-confirmation-required", "seat-reservation", "async-submit", "mobile-required"], "locale": "ja-JP" },
  "ux": { "primaryTask": "招待内容を確認して送信する", "secondaryTasks": ["入力へ戻って修正する", "Owner権限の影響を明示確認する"], "successCriteria": ["全宛先とRoleを送信前に説明できる", "Seat不足とOwner確認を送信前に解決できる"], "userRisks": ["誤ったRoleを送信する", "Seat不足のまま送信する", "二重送信する"], "assumptions": ["Ownerを含む時だけ確認checkboxを要求する", "送信中は再実行を防ぐ"] },
  "informationArchitecture": { "hierarchy": ["review-heading", "seat-impact", "recipient-summary", "owner-confirmation", "send-actions"], "navigationRole": "workflow-step", "contentGroups": [{ "id": "group_invite_summary", "title": "招待内容", "purpose": "宛先とRoleを最終確認する", "priority": "critical" }, { "id": "group_send_confirmation", "title": "送信確認", "purpose": "高権限とSeat影響を理解して確定する", "priority": "critical" }] },
  "layout": { "templateId": "review-and-confirm", "density": "default", "regions": [{ "id": "region_review_main", "role": "main", "purpose": "招待内容とSeat影響を表示する", "componentRefs": ["component_review_table", "component_seat_alert"] }, { "id": "region_review_footer", "role": "footer", "purpose": "修正と送信を提供する", "componentRefs": ["component_owner_confirmation", "component_send_invites"] }], "responsiveBehavior": [{ "viewport": "desktop", "behavior": "宛先とRoleを列で比較しactionを右下へ置く" }, { "viewport": "tablet", "behavior": "summary幅を抑えつつ比較列を維持する" }, { "viewport": "mobile", "behavior": "宛先ごとのsummaryへreflowしactionを読み順末尾へ置く" }] },
  "components": [{ "id": "component_review_table", "componentId": "table", "purpose": "送信対象とRoleを比較表示する", "props": { "selectable": false }, "meridianTokens": ["--surface", "--border"], "states": ["default"], "accessibilityNotes": ["列見出しを保持する"] }, { "id": "component_seat_alert", "componentId": "alert", "purpose": "Seat不足または予約影響を説明する", "props": { "variant": "warning" }, "meridianTokens": ["--warning", "--warning-fg"], "states": ["default"], "accessibilityNotes": ["不足数と回復操作を文言で示す"] }, { "id": "component_owner_confirmation", "componentId": "checkbox", "purpose": "Owner権限の影響を明示確認する", "props": { "required": true }, "meridianTokens": ["--primary", "--focus-ring"], "states": ["default", "checked", "error"], "accessibilityNotes": ["Ownerが含まれる場合だけ表示し説明と関連付ける"] }, { "id": "component_send_invites", "componentId": "button", "purpose": "確認済み招待を一度だけ送信する", "props": { "variant": "primary" }, "meridianTokens": ["--primary", "--primary-on-solid"], "states": ["default", "disabled", "loading"], "accessibilityNotes": ["送信中を名前とstatus messageで通知する"] }],
  "states": { "default": { "applicable": true, "description": "招待対象、Role、Seat影響を確認できる", "componentRefs": ["component_review_table", "component_owner_confirmation", "component_send_invites"], "userRecovery": null }, "loading": { "applicable": true, "description": "送信中は内容を保持し二重送信を防ぐ", "componentRefs": ["component_send_invites"], "userRecovery": "送信結果を待つ" }, "empty": { "applicable": true, "description": "送信対象がなく確認を完了できない", "componentRefs": ["component_review_table"], "userRecovery": "入力へ戻る" }, "error": { "applicable": true, "description": "Seat不足または送信前検証の問題を示す", "componentRefs": ["component_seat_alert", "component_send_invites"], "userRecovery": "入力または契約Seatを修正する" }, "permissionDenied": { "applicable": true, "description": "送信権限が失われたことを説明する", "componentRefs": ["component_seat_alert"], "userRecovery": "Owner権限を確認する" } },
  "accessibility": { "wcagTarget": "WCAG-2.2-AA", "keyboardInteractions": ["summary、確認checkbox、actionを論理順で操作する"], "focusManagement": ["入力から進んだ時にreview headingへfocusする", "送信前errorは該当summaryへ移す"], "screenReaderNotes": ["送信中と結果をstatus messageで通知する"], "nonColorCues": ["警告icon、見出し、説明を併用する"] },
  "rationale": [{ "decision": "入力と送信の間に確認stepを置く", "reason": "宛先と高権限の誤設定を送信前に発見するため", "evidenceType": "accessibility", "tradeoff": "完了まで1step増える", "references": ["flow_team_invite", "phase1_team_invitation"] }],
  "qualityChecks": { "tokenComplianceRequired": true, "componentRegistryComplianceRequired": true, "keyboardRequired": true, "responsiveRequired": true, "stateCoverageRequired": true, "rationaleRequired": true, "unresolvedItems": ["実環境のSeat購入導線"] }
}
