{
  "meta": { "schemaVersion": "0.1.0", "kind": "screen", "id": "screen_invite_success", "title": "Invitation Result", "source": "manual", "status": "candidate" },
  "context": { "productType": "team-management", "targetUsers": ["workspace-owner"], "primaryUseCase": "招待送信結果を理解して次の行動を選ぶ", "userIntent": "誰に送信でき、問題があれば誰を修正すべきか把握したい", "constraints": ["partial-success-required", "async-result", "no-successful-recipient-resend", "mobile-required"], "locale": "ja-JP" },
  "ux": { "primaryTask": "成功宛先と失敗宛先を分けて結果を処理する", "secondaryTasks": ["失敗行だけ再試行する", "Members一覧へ戻る", "追加で招待する"], "successCriteria": ["成功と失敗を宛先単位で説明できる", "成功宛先を再送せず失敗だけ修正できる"], "userRisks": ["一部失敗を全失敗と誤認する", "成功済み宛先を再送する"], "assumptions": ["成功行は確定して編集対象から外す", "一覧反映失敗と招待送信失敗を区別する"] },
  "informationArchitecture": { "hierarchy": ["result-heading", "result-summary", "failed-recipients", "recovery-actions", "next-actions"], "navigationRole": "workflow-step", "contentGroups": [{ "id": "group_invite_result", "title": "送信結果", "purpose": "成功、Pending、失敗を宛先単位で示す", "priority": "critical" }, { "id": "group_result_actions", "title": "次の操作", "purpose": "失敗修正またはMembers一覧への移動を提供する", "priority": "high" }] },
  "layout": { "templateId": "operation-result", "density": "default", "regions": [{ "id": "region_result_main", "role": "main", "purpose": "招待結果と回復方法を表示する", "componentRefs": ["component_result_alert", "component_result_table", "component_result_status"] }, { "id": "region_result_footer", "role": "footer", "purpose": "再試行と一覧へ戻る操作を提供する", "componentRefs": ["component_result_action"] }], "responsiveBehavior": [{ "viewport": "desktop", "behavior": "結果summaryと宛先別状態を同時に表示する" }, { "viewport": "tablet", "behavior": "結果列を維持して補助説明を折りたたむ" }, { "viewport": "mobile", "behavior": "宛先別結果をcard状にreflowし回復actionを各失敗へ近接させる" }] },
  "components": [{ "id": "component_result_alert", "componentId": "alert", "purpose": "全体の成功または一部失敗を説明する", "props": { "variant": "success" }, "meridianTokens": ["--success", "--success-fg"], "states": ["default"], "accessibilityNotes": ["結果summaryをstatusとして通知する"] }, { "id": "component_result_table", "componentId": "table", "purpose": "宛先別の送信結果を表示する", "props": { "selectable": false }, "meridianTokens": ["--surface", "--border"], "states": ["default", "empty"], "accessibilityNotes": ["宛先、Role、結果の列関係を維持する"] }, { "id": "component_result_status", "componentId": "status-indicator", "purpose": "Success、Pending、Failedを非色依存で示す", "props": { "variant": "success" }, "meridianTokens": ["--fg", "--fg-muted"], "states": ["default"], "accessibilityNotes": ["状態名を可視文言で示す"] }, { "id": "component_result_action", "componentId": "button", "purpose": "失敗行の再試行またはMembers一覧へ移動する", "props": { "variant": "primary" }, "meridianTokens": ["--primary", "--primary-on-solid"], "states": ["default", "loading"], "accessibilityNotes": ["action名に対象と結果を含める"] }],
  "states": { "default": { "applicable": true, "description": "成功と失敗を宛先単位で表示する", "componentRefs": ["component_result_alert", "component_result_table", "component_result_status", "component_result_action"], "userRecovery": null }, "loading": { "applicable": true, "description": "失敗行の再試行中も既存成功結果を保持する", "componentRefs": ["component_result_action"], "userRecovery": "再試行結果を待つ" }, "empty": { "applicable": true, "description": "結果データを取得できない場合も送信操作の状態を推測しない", "componentRefs": ["component_result_alert"], "userRecovery": "Members一覧でPendingを確認する" }, "error": { "applicable": true, "description": "失敗宛先と理由、再試行方法を示す", "componentRefs": ["component_result_alert", "component_result_table", "component_result_action"], "userRecovery": "失敗宛先だけ修正して再試行する" }, "permissionDenied": { "applicable": true, "description": "結果は維持し再試行権限がないことを示す", "componentRefs": ["component_result_alert"], "userRecovery": "Ownerへ再試行を依頼する" } },
  "accessibility": { "wcagTarget": "WCAG-2.2-AA", "keyboardInteractions": ["結果から失敗行と回復actionへ順に移動する"], "focusManagement": ["送信完了時に結果headingへfocusする", "再試行後は更新された失敗行へ戻す"], "screenReaderNotes": ["成功件数、失敗件数、更新結果をlive regionで通知する"], "nonColorCues": ["状態名、icon、説明を併記する"] },
  "rationale": [{ "decision": "Partial successでは成功行を確定して失敗行だけ残す", "reason": "成功済み宛先の重複送信を防ぐため", "evidenceType": "user-goal", "tradeoff": "結果stateの管理が複雑になる", "references": ["phase1_team_invitation", "flow_team_invite"] }],
  "qualityChecks": { "tokenComplianceRequired": true, "componentRegistryComplianceRequired": true, "keyboardRequired": true, "responsiveRequired": true, "stateCoverageRequired": true, "rationaleRequired": true, "unresolvedItems": ["実APIのfailure taxonomy"] }
}
