{
  "meta": { "schemaVersion": "0.1.0", "kind": "screen", "id": "screen_team_members", "title": "Team Members", "source": "manual", "status": "candidate" },
  "context": { "productType": "team-management", "targetUsers": ["workspace-owner", "workspace-admin", "workspace-viewer"], "primaryUseCase": "既存メンバーと招待中メンバーを確認して招待を開始する", "userIntent": "誰が参加済みで誰が招待中かを把握し、必要なら新しいメンバーを招待したい", "constraints": ["role-sensitive", "desktop-tablet-mobile", "pending-state-required"], "locale": "ja-JP" },
  "ux": { "primaryTask": "メンバー状態を確認して招待を開始する", "secondaryTasks": ["Pending招待を確認する", "招待を再送または取消する"], "successCriteria": ["参加済みとPendingを区別できる", "権限がある利用者だけ招待を開始できる"], "userRisks": ["Pendingを参加済みと誤認する", "権限がない理由を理解できない"], "assumptions": ["Ownerが招待操作を所有する", "Pendingは使用Seatと分けて表示する"] },
  "informationArchitecture": { "hierarchy": ["page-heading", "seat-summary", "member-list", "pending-invitations", "invite-action"], "navigationRole": "overview", "contentGroups": [{ "id": "group_member_list", "title": "メンバー", "purpose": "参加済みと招待中のメンバーを状態付きで一覧する", "priority": "critical" }, { "id": "group_invite_action", "title": "招待操作", "purpose": "権限を確認して招待フローを開始する", "priority": "high" }] },
  "layout": { "templateId": "entity-management-list", "density": "default", "regions": [{ "id": "region_member_main", "role": "main", "purpose": "メンバーとPending招待を表示する", "componentRefs": ["component_member_table", "component_member_status"] }, { "id": "region_member_toolbar", "role": "toolbar", "purpose": "招待開始操作を提供する", "componentRefs": ["component_invite_button"] }], "responsiveBehavior": [{ "viewport": "desktop", "behavior": "状態とRoleを列で比較できるtableを表示する" }, { "viewport": "tablet", "behavior": "重要列を維持し補助情報を折りたたむ" }, { "viewport": "mobile", "behavior": "各メンバーを読み順を保つcard状の行へreflowする" }] },
  "components": [{ "id": "component_member_table", "componentId": "table", "purpose": "メンバー、Role、招待状態を比較する", "props": { "selectable": false }, "meridianTokens": ["--surface", "--border"], "states": ["default", "loading", "empty", "error"], "accessibilityNotes": ["列見出しと各値の関係を維持する"] }, { "id": "component_member_status", "componentId": "status-indicator", "purpose": "Active、Pending、Expiredを非色依存で示す", "props": { "variant": "idle" }, "meridianTokens": ["--fg", "--fg-muted"], "states": ["default"], "accessibilityNotes": ["色だけでなく状態名を表示する"] }, { "id": "component_invite_button", "componentId": "button", "purpose": "招待フローを開始する", "props": { "variant": "primary" }, "meridianTokens": ["--primary", "--primary-on-solid"], "states": ["default", "disabled"], "accessibilityNotes": ["権限不足時は理由を説明する"] }],
  "states": { "default": { "applicable": true, "description": "参加済みとPendingを状態付きで表示する", "componentRefs": ["component_member_table", "component_member_status", "component_invite_button"], "userRecovery": null }, "loading": { "applicable": true, "description": "一覧の読み込み中であることを通知する", "componentRefs": ["component_member_table"], "userRecovery": null }, "empty": { "applicable": true, "description": "メンバーがいない場合に最初の招待を案内する", "componentRefs": ["component_member_table", "component_invite_button"], "userRecovery": "招待を開始する" }, "error": { "applicable": true, "description": "一覧取得失敗を説明する", "componentRefs": ["component_member_table"], "userRecovery": "再読み込みする" }, "permissionDenied": { "applicable": true, "description": "閲覧はできるが招待できない理由を示す", "componentRefs": ["component_invite_button"], "userRecovery": "Ownerへ依頼する" } },
  "accessibility": { "wcagTarget": "WCAG-2.2-AA", "keyboardInteractions": ["招待操作と行actionへTabで移動できる"], "focusManagement": ["一覧更新後も現在位置を維持する"], "screenReaderNotes": ["非同期更新をstatus messageで通知する"], "nonColorCues": ["状態名とiconを併記する"] },
  "rationale": [{ "decision": "参加済みとPendingを同じ管理文脈で表示する", "reason": "招待後の状態確認と再送・取消を分断しないため", "evidenceType": "user-goal", "tradeoff": "一覧の状態種類が増える", "references": ["flow_team_invite", "phase1_team_invitation"] }],
  "qualityChecks": { "tokenComplianceRequired": true, "componentRegistryComplianceRequired": true, "keyboardRequired": true, "responsiveRequired": true, "stateCoverageRequired": true, "rationaleRequired": true, "unresolvedItems": ["実ユーザーによる一覧密度評価"] }
}
