{
  "meta": { "schemaVersion": "0.1.0", "kind": "screen", "id": "screen_invite_member_dialog", "title": "Invite Member Input", "source": "manual", "status": "candidate" },
  "context": { "productType": "team-management", "targetUsers": ["workspace-owner"], "primaryUseCase": "招待先とRoleを入力する", "userIntent": "招待対象と付与権限を間違えずに入力したい", "constraints": ["maximum-10-recipients", "per-recipient-role", "owner-only", "mobile-required"], "locale": "ja-JP" },
  "ux": { "primaryTask": "招待先ごとにEmailとRoleを設定する", "secondaryTasks": ["入力行を追加・削除する", "Roleの影響を確認する"], "successCriteria": ["各行のEmailとRoleを対応付けられる", "不正・重複・Pendingを行単位で修正できる"], "userRisks": ["宛先とRoleを取り違える", "既存Pendingを重複招待する"], "assumptions": ["有効なPendingは予約Seatとして扱う", "不正行がある間は確認へ進めない"] },
  "informationArchitecture": { "hierarchy": ["dialog-heading", "seat-summary", "invitation-rows", "validation-summary", "actions"], "navigationRole": "modal", "contentGroups": [{ "id": "group_invitation_input", "title": "招待するメンバー", "purpose": "EmailとRoleを行単位で編集する", "priority": "critical" }, { "id": "group_input_actions", "title": "入力操作", "purpose": "確認へ進むか入力を破棄する", "priority": "high" }] },
  "layout": { "templateId": "batch-entry-dialog", "density": "default", "regions": [{ "id": "region_invite_overlay", "role": "overlay", "purpose": "入力を現在のMembers文脈に重ねる", "componentRefs": ["component_invite_dialog"] }, { "id": "region_invite_main", "role": "main", "purpose": "EmailとRoleの入力を提供する", "componentRefs": ["component_invite_email", "component_invite_role", "component_invite_validation"] }, { "id": "region_invite_footer", "role": "footer", "purpose": "取消と確認操作を提供する", "componentRefs": ["component_invite_continue"] }], "responsiveBehavior": [{ "viewport": "desktop", "behavior": "EmailとRoleを同じ行で比較する" }, { "viewport": "tablet", "behavior": "Dialog幅をviewport内に制限する" }, { "viewport": "mobile", "behavior": "各招待行をEmail、Role、errorの順に縦積みする" }] },
  "components": [{ "id": "component_invite_dialog", "componentId": "dialog", "purpose": "入力フローのmodal境界とfocus lifecycleを所有する", "props": { "modal": true }, "meridianTokens": ["--surface", "--border"], "states": ["default"], "accessibilityNotes": ["開いた時に見出しまたは最初の入力へfocusする"] }, { "id": "component_invite_email", "componentId": "text-field", "purpose": "招待先Emailを入力する", "props": { "type": "email" }, "meridianTokens": ["--input-bg", "--input-border", "--focus-ring"], "states": ["default", "focus", "error"], "accessibilityNotes": ["行errorをaria-describedbyで関連付ける"] }, { "id": "component_invite_role", "componentId": "select", "purpose": "招待先へ付与するRoleを選択する", "props": { "required": true }, "meridianTokens": ["--input-bg", "--input-border"], "states": ["default", "focus", "disabled"], "accessibilityNotes": ["Role名と影響説明を関連付ける"] }, { "id": "component_invite_validation", "componentId": "validation-message", "purpose": "問題と修正方法を行単位で示す", "props": { "variant": "error" }, "meridianTokens": ["--danger", "--danger-fg"], "states": ["default"], "accessibilityNotes": ["Error summaryから問題行へ移動できる"] }, { "id": "component_invite_continue", "componentId": "button", "purpose": "検証済み入力を確認へ進める", "props": { "variant": "primary" }, "meridianTokens": ["--primary", "--primary-on-solid"], "states": ["default", "disabled"], "accessibilityNotes": ["disabled理由をvalidationで説明する"] }],
  "states": { "default": { "applicable": true, "description": "1件以上の入力行を編集できる", "componentRefs": ["component_invite_dialog", "component_invite_email", "component_invite_role", "component_invite_continue"], "userRecovery": null }, "loading": { "applicable": true, "description": "Roleと既存状態を取得中として入力を保護する", "componentRefs": ["component_invite_dialog"], "userRecovery": "取得完了を待つ" }, "empty": { "applicable": true, "description": "空の初期行から入力を開始できる", "componentRefs": ["component_invite_email", "component_invite_role"], "userRecovery": "EmailとRoleを入力する" }, "error": { "applicable": true, "description": "不正、重複、Pendingを該当行へ表示する", "componentRefs": ["component_invite_email", "component_invite_validation"], "userRecovery": "問題行だけを修正する" }, "permissionDenied": { "applicable": true, "description": "Owner以外は入力を開始できない", "componentRefs": ["component_invite_dialog"], "userRecovery": "Ownerへ招待を依頼する" } },
  "accessibility": { "wcagTarget": "WCAG-2.2-AA", "keyboardInteractions": ["Tabで行内をEmail、Role、削除の順に移動する", "Escapeは破棄確認を経て閉じる"], "focusManagement": ["open時に見出しまたは最初のEmailへfocusする", "close時に起動buttonへ戻す", "validation失敗時にError summaryへ移す"], "screenReaderNotes": ["行追加・削除と検証結果をlive regionで通知する"], "nonColorCues": ["error icon、文言、aria-invalidを併用する"] },
  "rationale": [{ "decision": "宛先ごとにRoleを同じ編集単位へ置く", "reason": "一括招待でEmailと権限の対応を確認できるため", "evidenceType": "constraint", "tradeoff": "単一招待より入力面積が増える", "references": ["phase1_team_invitation", "flow_team_invite"] }],
  "qualityChecks": { "tokenComplianceRequired": true, "componentRegistryComplianceRequired": true, "keyboardRequired": true, "responsiveRequired": true, "stateCoverageRequired": true, "rationaleRequired": true, "unresolvedItems": ["10行時のMobile usability test"] }
}
